{
  "paper_id": "unknown_unknown_2023_prelims_shift_1_34dba86e",
  "source": {
    "pdf_path": "corpus/_unsorted/2023/LIC AAO pre 2023 memory based (20 Feb shift 1).pdf",
    "sha256": "34dba86e20ddd10e47a92e67d14e514bb650e9956045fce358d2982caa7ec2e5",
    "source_url": null,
    "source_filename": "LIC AAO pre 2023 memory based (20 Feb shift 1).pdf"
  },
  "bank": null,
  "role": null,
  "exam_type": "Prelims",
  "year": 2023,
  "shift": "Shift_1",
  "memory_based": true,
  "language": "english",
  "parse_status": "failed",
  "parse_notes": [
    "no_questions_parsed"
  ],
  "question_count": 0,
  "questions": []
}